{
  "value": [
    {"id":"bagerhat","en":"Bagerhat","bn":"বাগেরহাট","division":"Khulna","divisionBn":"খুলনা","lat":22.6516,"lng":89.7859},
    {"id":"bandarban","en":"Bandarban","bn":"বান্দরবান","division":"Chattogram","divisionBn":"চট্টগ্রাম","lat":22.1953,"lng":92.2184},
    {"id":"barguna","en":"Barguna","bn":"বরগুনা","division":"Barishal","divisionBn":"বরিশাল","lat":22.1592,"lng":90.1256},
    {"id":"barishal","en":"Barishal","bn":"বরিশাল","division":"Barishal","divisionBn":"বরিশাল","lat":22.7004,"lng":90.3732},
    {"id":"bhola","en":"Bhola","bn":"ভোলা","division":"Barishal","divisionBn":"বরিশাল","lat":22.6859,"lng":90.6482},
    {"id":"bogura","en":"Bogura","bn":"বগুড়া","division":"Rajshahi","divisionBn":"রাজশাহী","lat":24.8465,"lng":89.3778},
    {"id":"brahmanbaria","en":"Brahmanbaria","bn":"ব্রাহ্মণবাড়িয়া","division":"Chattogram","divisionBn":"চট্টগ্রাম","lat":23.9571,"lng":91.1119},
    {"id":"chandpur","en":"Chandpur","bn":"চাঁদপুর","division":"Chattogram","divisionBn":"চট্টগ্রাম","lat":23.2333,"lng":90.6713},
    {"id":"chapainawabganj","en":"Chapainawabganj","bn":"চাঁপাইনবাবগঞ্জ","division":"Rajshahi","divisionBn":"রাজশাহী","lat":24.5965,"lng":88.2775},
    {"id":"chattogram","en":"Chattogram","bn":"চট্টগ্রাম","division":"Chattogram","divisionBn":"চট্টগ্রাম","lat":22.3351,"lng":91.8341},
    {"id":"chuadanga","en":"Chuadanga","bn":"চুয়াডাঙ্গা","division":"Khulna","divisionBn":"খুলনা","lat":23.6402,"lng":88.8418},
    {"id":"coxs-bazar","en":"Cox's Bazar","bn":"কক্সবাজার","division":"Chattogram","divisionBn":"চট্টগ্রাম","lat":21.4432,"lng":91.9738},
    {"id":"cumilla","en":"Cumilla","bn":"কুমিল্লা","division":"Chattogram","divisionBn":"চট্টগ্রাম","lat":23.4683,"lng":91.1788},
    {"id":"dhaka","en":"Dhaka","bn":"ঢাকা","division":"Dhaka","divisionBn":"ঢাকা","lat":23.7115,"lng":90.4111},
    {"id":"dinajpur","en":"Dinajpur","bn":"দিনাজপুর","division":"Rangpur","divisionBn":"রংপুর","lat":25.6217,"lng":88.6355},
    {"id":"faridpur","en":"Faridpur","bn":"ফরিদপুর","division":"Dhaka","divisionBn":"ঢাকা","lat":23.6071,"lng":89.8429},
    {"id":"feni","en":"Feni","bn":"ফেনী","division":"Chattogram","divisionBn":"চট্টগ্রাম","lat":23.0232,"lng":91.3841},
    {"id":"gaibandha","en":"Gaibandha","bn":"গাইবান্ধা","division":"Rangpur","divisionBn":"রংপুর","lat":25.3288,"lng":89.5281},
    {"id":"gazipur","en":"Gazipur","bn":"গাজীপুর","division":"Dhaka","divisionBn":"ঢাকা","lat":24.0023,"lng":90.4264},
    {"id":"gopalganj","en":"Gopalganj","bn":"গোপালগঞ্জ","division":"Dhaka","divisionBn":"ঢাকা","lat":23.0051,"lng":89.8266},
    {"id":"habiganj","en":"Habiganj","bn":"হবিগঞ্জ","division":"Sylhet","divisionBn":"সিলেট","lat":24.3749,"lng":91.4155},
    {"id":"jamalpur","en":"Jamalpur","bn":"জামালপুর","division":"Mymensingh","divisionBn":"ময়মনসিংহ","lat":24.9375,"lng":89.9378},
    {"id":"jashore","en":"Jashore","bn":"যশোর","division":"Khulna","divisionBn":"খুলনা","lat":23.1664,"lng":89.2081},
    {"id":"jhalokati","en":"Jhalokati","bn":"ঝালকাঠি","division":"Barishal","divisionBn":"বরিশাল","lat":22.6423,"lng":90.2004},
    {"id":"jhenaidah","en":"Jhenaidah","bn":"ঝিনাইদহ","division":"Khulna","divisionBn":"খুলনা","lat":23.5448,"lng":89.1539},
    {"id":"joypurhat","en":"Joypurhat","bn":"জয়পুরহাট","division":"Rajshahi","divisionBn":"রাজশাহী","lat":25.0964,"lng":89.04},
    {"id":"khagrachhari","en":"Khagrachhari","bn":"খাগড়াছড়ি","division":"Chattogram","divisionBn":"চট্টগ্রাম","lat":23.1193,"lng":91.9847},
    {"id":"khulna","en":"Khulna","bn":"খুলনা","division":"Khulna","divisionBn":"খুলনা","lat":22.8158,"lng":89.5687},
    {"id":"kishoreganj","en":"Kishoreganj","bn":"কিশোরগঞ্জ","division":"Dhaka","divisionBn":"ঢাকা","lat":24.4449,"lng":90.7766},
    {"id":"kurigram","en":"Kurigram","bn":"কুড়িগ্রাম","division":"Rangpur","divisionBn":"রংপুর","lat":25.8054,"lng":89.6362},
    {"id":"kushtia","en":"Kushtia","bn":"কুষ্টিয়া","division":"Khulna","divisionBn":"খুলনা","lat":23.9013,"lng":89.1205},
    {"id":"lakshmipur","en":"Lakshmipur","bn":"লক্ষ্মীপুর","division":"Chattogram","divisionBn":"চট্টগ্রাম","lat":22.9425,"lng":90.8412},
    {"id":"lalmonirhat","en":"Lalmonirhat","bn":"লালমনিরহাট","division":"Rangpur","divisionBn":"রংপুর","lat":25.9165,"lng":89.4532},
    {"id":"madaripur","en":"Madaripur","bn":"মাদারীপুর","division":"Dhaka","divisionBn":"ঢাকা","lat":23.1641,"lng":90.1897},
    {"id":"magura","en":"Magura","bn":"মাগুরা","division":"Khulna","divisionBn":"খুলনা","lat":23.4873,"lng":89.42},
    {"id":"manikganj","en":"Manikganj","bn":"মানিকগঞ্জ","division":"Dhaka","divisionBn":"ঢাকা","lat":23.8602,"lng":90.0018},
    {"id":"meherpur","en":"Meherpur","bn":"মেহেরপুর","division":"Khulna","divisionBn":"খুলনা","lat":23.7622,"lng":88.6318},
    {"id":"moulvibazar","en":"Moulvibazar","bn":"মৌলভীবাজার","division":"Sylhet","divisionBn":"সিলেট","lat":24.4829,"lng":91.7774},
    {"id":"munshiganj","en":"Munshiganj","bn":"মুন্সিগঞ্জ","division":"Dhaka","divisionBn":"ঢাকা","lat":23.5436,"lng":90.5354},
    {"id":"mymensingh","en":"Mymensingh","bn":"ময়মনসিংহ","division":"Mymensingh","divisionBn":"ময়মনসিংহ","lat":24.7466,"lng":90.4072},
    {"id":"naogaon","en":"Naogaon","bn":"নওগাঁ","division":"Rajshahi","divisionBn":"রাজশাহী","lat":24.8326,"lng":88.9249},
    {"id":"narail","en":"Narail","bn":"নড়াইল","division":"Khulna","divisionBn":"খুলনা","lat":23.1725,"lng":89.5127},
    {"id":"narayanganj","en":"Narayanganj","bn":"নারায়ণগঞ্জ","division":"Dhaka","divisionBn":"ঢাকা","lat":23.6337,"lng":90.4965},
    {"id":"narsingdi","en":"Narsingdi","bn":"নরসিংদী","division":"Dhaka","divisionBn":"ঢাকা","lat":23.9322,"lng":90.7154},
    {"id":"natore","en":"Natore","bn":"নাটোর","division":"Rajshahi","divisionBn":"রাজশাহী","lat":24.4206,"lng":89.0003},
    {"id":"netrokona","en":"Netrokona","bn":"নেত্রকোণা","division":"Mymensingh","divisionBn":"ময়মনসিংহ","lat":24.871,"lng":90.7279},
    {"id":"nilphamari","en":"Nilphamari","bn":"নীলফামারী","division":"Rangpur","divisionBn":"রংপুর","lat":25.9318,"lng":88.856},
    {"id":"noakhali","en":"Noakhali","bn":"নোয়াখালী","division":"Chattogram","divisionBn":"চট্টগ্রাম","lat":22.8696,"lng":91.0994},
    {"id":"pabna","en":"Pabna","bn":"পাবনা","division":"Rajshahi","divisionBn":"রাজশাহী","lat":23.9985,"lng":89.2336},
    {"id":"panchagarh","en":"Panchagarh","bn":"পঞ্চগড়","division":"Rangpur","divisionBn":"রংপুর","lat":26.3411,"lng":88.5542},
    {"id":"patuakhali","en":"Patuakhali","bn":"পটুয়াখালী","division":"Barishal","divisionBn":"বরিশাল","lat":22.3596,"lng":90.3299},
    {"id":"pirojpur","en":"Pirojpur","bn":"পিরোজপুর","division":"Barishal","divisionBn":"বরিশাল","lat":22.5781,"lng":89.9984},
    {"id":"rajbari","en":"Rajbari","bn":"রাজবাড়ী","division":"Dhaka","divisionBn":"ঢাকা","lat":23.7574,"lng":89.6445},
    {"id":"rajshahi","en":"Rajshahi","bn":"রাজশাহী","division":"Rajshahi","divisionBn":"রাজশাহী","lat":24.3723,"lng":88.5631},
    {"id":"rangamati","en":"Rangamati","bn":"রাঙ্গামাটি","division":"Chattogram","divisionBn":"চট্টগ্রাম","lat":22.6556,"lng":92.1754},
    {"id":"rangpur","en":"Rangpur","bn":"রংপুর","division":"Rangpur","divisionBn":"রংপুর","lat":25.7558,"lng":89.2445},
    {"id":"satkhira","en":"Satkhira","bn":"সাতক্ষীরা","division":"Khulna","divisionBn":"খুলনা","lat":22.7181,"lng":89.0687},
    {"id":"shariatpur","en":"Shariatpur","bn":"শরীয়তপুর","division":"Dhaka","divisionBn":"ঢাকা","lat":23.206,"lng":90.3478},
    {"id":"sherpur","en":"Sherpur","bn":"শেরপুর","division":"Mymensingh","divisionBn":"ময়মনসিংহ","lat":25.0205,"lng":90.0153},
    {"id":"sirajganj","en":"Sirajganj","bn":"সিরাজগঞ্জ","division":"Rajshahi","divisionBn":"রাজশাহী","lat":24.4534,"lng":89.7007},
    {"id":"sunamganj","en":"Sunamganj","bn":"সুনামগঞ্জ","division":"Sylhet","divisionBn":"সিলেট","lat":25.0658,"lng":91.395},
    {"id":"sylhet","en":"Sylhet","bn":"সিলেট","division":"Sylhet","divisionBn":"সিলেট","lat":24.8898,"lng":91.8698},
    {"id":"tangail","en":"Tangail","bn":"টাঙ্গাইল","division":"Dhaka","divisionBn":"ঢাকা","lat":24.2641,"lng":89.918},
    {"id":"thakurgaon","en":"Thakurgaon","bn":"ঠাকুরগাঁও","division":"Rangpur","divisionBn":"রংপুর","lat":26.0337,"lng":88.4617}
  ],
  "unit": "degrees (WGS84), district headquarters",
  "source": "https://github.com/nuhil/bangladesh-geocode/blob/master/districts/districts.json",
  "checked": "2026-10-19",
  "note": "64 districts in 8 divisions. Coordinates and Bangla names from the bangladesh-geocode dataset (each row links its district portal, e.g. www.dhaka.gov.bd); English names use the 2018 official spellings (Chattogram, Cumilla, Barishal, Bogura, Jashore). Used by the sehri-iftar engine."
}
