{
  "value": [
    {
      "upTo": 400000,
      "duty": 0
    },
    {
      "upTo": 500000,
      "duty": 150
    },
    {
      "upTo": 1000000,
      "duty": 500
    },
    {
      "upTo": 5000000,
      "duty": 3000
    },
    {
      "upTo": null,
      "duty": 15000
    }
  ],
  "unit": "BDT per year by highest balance",
  "source": "https://nbr.gov.bd/",
  "checked": "2000-01-01",
  "note": "unverified — seeded from Figma/test fixture"
}
